title,github_account,paper,paper_title,doi,browser,abstract,citation,citation_count,lay,partition,abstraction,focus,scale,view,sparse type,contiguous type,interconnection,arrangement,access_format,pub_year,License,image
Sashimi Plot,,https://www.ncbi.nlm.nih.gov/pmc/articles/PMC4542614/,"""Sashimi plots: Quantitative visualization of RNA sequencing read alignments""",10.1093/bioinformatics/btv034,https://software.broadinstitute.org/software/igv/Sashimi,"""Motivation: Analysis of RNA sequencing (RNA-Seq) data revealed that the vast majority of human genes express multiple mRNA isoforms, produced by alternative pre-mRNA splicing and other mechanisms, and that most alternative isoforms vary in expression between human tissues. As RNA-Seq datasets grow in size, it remains challenging to visualize isoform expression across multiple samples. Results: To help address this problem, we present Sashimi plots, a quantitative visualization of aligned RNA-Seq reads that enables quantitative comparison of exon usage across samples or experimental conditions. Sashimi plots can be made using the Broad Integrated Genome Viewer or with a stand-alone command line program.""","""Katz Y, Wang ET, Silterra J, Schwartz S, Wong B, Mesirov JP, et al. Sashimi plots: Quantitative visualization of RNA sequencing read alignments [Internet]. arXiv [q-bio.GN]. 2013. Available: http://arxiv.org/abs/1306.3466""",8,linear,contiguous,none,single,single,single,point sparse,,within,,web browser,2015,,/assets/Sashimi.png
Gremlin,,https://www.ncbi.nlm.nih.gov/pubmed/20975128,"""Gremlin: an interactive visualization model for analyzing genomic rearrangements.""",10.1109/TVCG.2010.163,http://compbio-research.cs.brown.edu/software/Gremlin/geneVisDemo.html,"""In this work we present, apply, and evaluate a novel, interactive visualization model for comparative analysis of structural variants and rearrangements in human and cancer genomes, with emphasis on data integration and uncertainty visualization. To support both global trend analysis and local feature detection, this model enables explorations continuously scaled from the high-level, complete genome perspective, down to the low-level, structural rearrangement view, while preserving global context at all times. We have implemented these techniques in Gremlin, a genomic rearrangement explorer with multi-scale, linked interactions, which we apply to four human cancer genome data sets for evaluation. Using an insight-based evaluation methodology, we compare Gremlin to Circos, the state-of-the-art in genomic rearrangement visualization, through a small user study with computational biologists working in rearrangement analysis. Results from user study evaluations demonstrate that this visualization model enables more total insights, more insights per minute, and more complex insights than the current state-of-the-art for visual analysis and exploration of genome rearrangements.""","""O’Brien TM, Ritz AM, Raphael BJ, Laidlaw DH. Gremlin: an interactive visualization model for analyzing genomic rearrangements. IEEE Trans Vis Comput Graph. ieeexplore.ieee.org; 2010;16: 918–926.""",29,linear,contiguous,none,single,multiple,multiple,segment sparse,,within,,"['web browser', 'software']",2010,,/assets/Gremlin.png
Lollipop Plot cBio,,https://www.ncbi.nlm.nih.gov/pubmed/22588877,"""The cBio cancer genomics portal: an open platform for exploring multidimensional cancer genomics data.""",10.1158/2159-8290.CD-12-0095,https://www.cbioportal.org/results/mutations?session_id=5d0a75b0e4b0ab41378767ca,"""The cBio Cancer Genomics Portal (http://cbioportal.org) is an open-access resource for interactive exploration of multidimensional cancer genomics data sets, currently providing access to data from more than 5,000 tumor samples from 20 cancer studies. The cBio Cancer Genomics Portal significantly lowers the barriers between complex genomic data and cancer researchers who want rapid, intuitive, and high-quality access to molecular profiles and clinical attributes from large-scale cancer genomics projects and empowers researchers to translate these rich data sets into biologic insights and clinical applications.""","""Cerami E, Gao J, Dogrusoz U, Gross BE, Sumer SO, Aksoy BA, et al. The cBio cancer genomics portal: an open platform for exploring multidimensional cancer genomics data. Cancer Discov. AACR; 2012;2: 401–404.""",4710,linear,contiguous,none,single,single ,single,point sparse,,none,,web browser,2012,,/assets/Lollipop.png
WebLogo,,https://www.ncbi.nlm.nih.gov/pubmed/15173120,"""WebLogo: a sequence logo generator.""",10.1101/gr.849004,https://weblogo.berkeley.edu/logo.cgi,"""WebLogo generates sequence logos, graphical representations of the patterns within a multiple sequence alignment. Sequence logos provide a richer and more precise description of sequence similarity than consensus sequences and can rapidly reveal significant features of the alignment otherwise difficult to perceive. Each logo consists of stacks of letters, one stack for each position in the sequence. The overall height of each stack indicates the sequence conservation at that position (measured in bits), whereas the height of symbols within the stack reflects the relative frequency of the corresponding amino or nucleic acid at that position. WebLogo has been enhanced recently with additional features and options, to provide a convenient and highly configurable sequence logo generator. A command line interface and the complete, open WebLogo source code are available for local installation and customization.""","""Crooks GE, Hon G, Chandonia J-M, Brenner SE. WebLogo: a sequence logo generator. Genome Res. genome.cshlp.org; 2004;14: 1188–1190.""",7486,linear,contiguous,none,single,single,single,,point contiguous,none,,web browser,2004,,/assets/Weblogo.png
ggBio,,https://genomebiology.biomedcentral.com/articles/10.1186/gb-2012-13-8-r77,"""ggbio: an R package for extending the grammar of graphics for genomic data""",10.1186/gb-2012-13-8-r77,https://bioconductor.org/packages/release/bioc/html/ggbio.html,,"""Yin T, Cook D, Lawrence M. ggbio: an R package for extending the grammar of graphics for genomic data. Genome Biol. genomebiology.biomedcentral.com; 2012;13: R77.""",145,linear,,,single,single,single,,,,,r package,2012,,
